{
  "schema_version": "1.0.0",
  "run_id": "550e8400-e29b-41d4-a716-446655440000",
  "route": "INTEGRATED",
  "review_verdict": "CONDITIONAL_PASS",
  "scope_limitations": [],
  "total_findings": 3,
  "blocker_count": 0,
  "critical_count": 0,
  "major_count": 1,
  "minor_count": 1,
  "info_count": 1,
  "business_confirmation_required_count": 1,
  "summary": "One major consistency gap found. Requires business confirmation before finalizing."
}
